	rstrt_name	final
294	수라한정식	한정식 상견례 한정식 음식 송림 울산 장소 냉채 수라 후기 사진 저희 준비 인사 체험 된장찌개 메뉴 요리 추천 걱정 구이 고성군소상공인이야기 수라한정식 경남고성맛집 경남고성가볼만한곳 고성맛집 고성한정식 한정식 모범음식점
295	우성갈비	
296	정든집	
297	주남오리궁(동읍)	
298	캠프흙시루가든	
299	짜장박사	중국식  쟁반짜장 인천광역시 중식 미추홀 번길 동구 인하 짬뽕 짜장 반점 당첨 일반 택배 경인로 박사 주안 참여 나눔 인주대로 인원 인천 쟁반짜장맛집 쟁반짜장 고성맛집
300	남해 대청마루	
301	하나로횟집	생선회 감사 광양시 내곡 리스 미리 상호 오늘 오징어 음식점 전라남도 하나로 한식 횟집 광양맛집 망덕포구 하나로횟집 망덕재첩국수 돼지고기육전 광양맛집 망덕포구맛집 재첩국수맛집 순천맛집 여수맛집 광양특화음식 자연산회맛집 전어축제 장어구이맛집 벚꿀맛집
302	수정숯불갈비	한정식 영양돌솥밥 창선고사리 육개장 추천 갈비 수정 숯불 공기 김치 김치찌개 돼지고기 두부 뚝딱 맛집 매장 메뉴 북구 사유 상호 연암동 울산 이미지 전화 삼겹살 오늘저녁은삼겹살 수정숯불갈비 오늘은외식 외식 배추쌈 배추 명이나물 저녁 저녁메뉴 외식스타그램 삼겹살파티 삼겹살맛집 겉절이맛집 일상 먹스타그램 고기스타그램 삼겹살그램
303	촌놈횟집	생선회매운탕 남해 오늘 오디 저희 낚시 도착 독일 루트 마을 모래 물건항 비치 살이 상주 새벽 생각 신랑 아이 입성 지굼 촌놈횟집-✔작년 대방어코스요리 생선내장수육 인천대방어 송도대방어 대방어숙성회 대방어코스 인천횟집 인천촌놈횟집 송도횟집 인천송도맛집
304	제일횟집	생선회회덮밥 횟집 배달 주문 진짜 추천 고기 창포 가능 근처 문의 안흥항 맛집 삼천포 오늘 제일 주변 진동 매운탕 숙박업소 초장 자갈치시장 꼼장어맛집 8년째방문 제일횟집 꼼장어시키면 산낙지 생선구이 선지국 중복엔 꼼장어양념구이
305	보물선횟집	생선회매운탕 남해 독일 횟집 라이딩 마을 맥주 답사 도로 모래 바다 비치 상주 설리 스카이 창선 그네 도착 맑은 물건 물건항 노가다 일상내
306	남해 어부림	
307	전망대횟집	생선회 횟집 게시판 남해 따님 맛집 아버님 어머님 요리 전망대 카페 홍보 비양도맛집 제주도횟집 한림맛집 전망대횟집 협재맛집 협재해수욕장맛집 협재맛집추천 제주도횟집추천
308	햇살복집	쫄복탕 복국 남해 추천 맛집 멸치 낚시 사부 고민 발견 복국 사람 식당 쌈밥 여행 오늘 오디 이번 저희 주말 처음 가족 햇살복집 복국 남해 뷰맛집
309	미소담	보쌈생선구이 남해 상견례 공간 미소 식당 기준 보쌈 작성 장소 진행 처음 추천 가격 경남 구성 독립 말씀 맛집 매우 메뉴 제주돌상 제주백일상 미소담⠀⠀
310	남해암소한마당	소고기 남해 카페 맛집 정말 추천 정치 걱정 게시판 기사 뉴스 물회 사장 스테이 욕설 유머 이미지 커피 가면 게시 경북 더풀 더풀버거 돌창고 돌창고프로젝트 아라마루아쿠아리움 양떼목장 미숫가루 말차라떼 쑥떡덩어리 남해암소한마당 한우스페셜 육사시미 땀
311	남해향촌	멸치쌈밥 두부 남해 향촌 낚시 맛집 체험 경남 출발 참석 투어 네이버 철수 사항 삼동면 시기 감성돔 멸치 시간 오전 지도 라이딩 남해향촌 남해여행 펜션앞바다
312	풍운정	생선구이정식 멸치쌈밥 남해 번호 주소 맛집 경남 서울 추천 감사 보리암 풍운 강남구 도움 메뉴 사천 여행 주신 동부 로코 마을 멸치 아난티남해 아난티 골프 힐튼남해 남면 해녀횟집 봉정식당 도다리쑥국 모듬사시미 풍운정 멸치쌈밥 생선구이 휴가 해물라면
313	남해 사랑채	
314	섬진강식당	정식 된장찌개 추천 재첩 국내 궁금 바락 박스 생각 아이스 친구 해감 가득 가요 광주 국물 근처 냉동 녹지 다라 미혼 배송 구례 섬진강식당 산채더덕구이정식 6시내고향맛집 구례맛집 함평 철성가든 능이닭백숙 향촌 육회비빔밥 해물탕 배민맛집 
315	청운식당	정식 된장찌개. 김치찌개 재첩국 하동 경상도 국물 나름 남자 다른 사장 산채정식 시크 식당 정식 청운 여행 먹스타그램 갈치조림 제주도 갈치 점심 청운식당
316	범바구집	옺닭 삼게탕 백숙 범바 진짜 갓김치 구라 닭죽 에놀 오늘 저녁 추천 포장 하동 하동읍 가기 거나 경상남도 그대로 그릇 닭다리 대박 20200806 2020여름휴가 경남하동맛집 범바구집 닭백숙 녹두닭죽 산삼주
317	이화가든	재첩국 참게탕 펜션 충청남도 서천군 서면 춘장 번길 갯벌 체험 비인면 민박 대길 바다 선도 장항 장항읍 해변 리스 하우스 도둔 남촌 제첩회무침 제첩국 섬진강제첩 이화가든
318	혜성식당	은어밥 참게탕 체험 놀꽃 벚꽃 우리 맛집 식당 혜성 오감 축제 문의 친구 당첨 놀이 예약 하동 포스팅 드로잉 키트 방문 전화 섬진강 쌍계사 은어 은어회 은어튀김 구례 화개천계곡 화개장터 화개장터맛집 혜성식당 하동여행 하동 구례여행
319	매실떡갈비	쌈밥정식 숟가락 고기 매실 설탕 약간 요리 재료 간장 참기름 깨소금 떡갈비 마늘 소금 소화 가능 갈비살 과정 균형 기본 기준 광양 제이축산 순천 여수 떡갈비 매실떡갈비반응좋은떡갈비
320	하동솔잎한우프라자	돼지고기 소고기 하동 정동원 양귀비 한우 가수 소고기 여행 음식점 축제 프라자 거제 고향 국수 길이 김밥 도착 미스터 솔잎 오늘 유지 하동 하동여행 하동솔잎한우프라자 솔잎한우프라자 한우 새우살 갈비살 제비추리 살치살 육회오랜만에
321	제일회센타	
322	향원식당	재첩국 참게정식 아동복 추천 현수막 논산 닭볶음탕 도매 백숙 식당 아시 앞쪽 연무대 오리 자라 정보 주물 큰아들 판매 향원 토요일 늦은아점 향원식당 상일동맛집 생선구이 2인 제육볶음 1인 양이많다👍
323	아리산반점	중화요리(짜장면우동 아리 반점 날씨 바람 블랙데이 성비 식욕 오늘 제로 페이 하루 신도림 아리산반점 짜장면 짬뽕 신도림맛집 신도림역맛집 도림천 짜장 구로구맛집 구로구 구로맛집 가성비맛집 가성비 짜장면맛집 짬뽕맛집 중식 중식맛집 중식당 맛집 맛집추천 맛집탐방 맛집스타그램 맛스타그램 먹스타그램 먹스타맞팔 먹팔 먹스타소통 좋반 좋반테러 나랑밥먹을래_신도림
324	물레방아식당	피리쪼림 번지 강원 맛집 전국 식당 막국수 횟집 구이 닭갈비 방향 위치 감사 입구 황태 매운탕 두부 산채 순두부 오징어 국수 지난이야기어설픈 강원도 강원도여행 강원 양양 양양여행 양양맛집 강원도계곡 물레방아휴게소 강원도계곡식당 양양계곡식당 물레방아식당
325	한양왕족발복어	복국 족발 복수육 맛집 가게 간판 단골 매운탕 복어 산청 수의 양왕 오늘 점심 족발 지리 진주 초고 복어국 한양왕족발복어 해장 최고
326	갑을식당	한방오리백숙 닭백숙 식당 맛집 식객 함양 부산 기행 허영 의령읍 함양군 찌게 추천 소개 음식 횟집 갈비 숯불 함양읍 광주 의령 방송 함양여행 갑을식당 곱창전골 짚라인 대봉스카이랜드 방아제한옥펜션
327	물장구식육식당	소고기 구이 체험 후기 포스팅 반드시 방문 예약 맛집 기간 내용 당첨 사항 작성 하단 산청 경우 발표 불가 산청군 상품 암소 소고기 합천 생비량 물장구식육식당
328	영도숯불갈비	육류구이한방갈비곰 산청 양수 진주 음식점 지목 갈비 경제 고급 군데 다음 마트 목화 박성민 부모님 빵집 상호 소비 숯불 스타 아시 인테리어 진주시이쁜집 주택리모델링 펫카페 릴리하우스메이킹 릴리엘르님❤ 영도숯불갈비 임헌수사단_부산경남
329	지리산장당계곡식당	
330	영실한우프라자	영실한우명품스페셜영실한우명품모둠영실한우꽃등심 한우 직접 산청 가격 광양 국물 우려 가장 소개 이용 프라자 고기 곰탕 남사 내기 다른 다시 라면 마을 매화 영실한우프라자 단성영실한우 산청소고기맛집 단성소고기맛집
331	동의약선관	약선한상약선코스요리약선특반상약선수라반상 맛집 식당 의령읍 의령 거창읍 방송 소바 산청 상견례 의령군 대의면 동의 선관 한식 함양읍 거창 산청읍 시천면 요미 저희 동의약선관 1박2일 선호찡 라비 문세윤 연정훈 딘딘 김종민 나도가고싶다 산청갑시다 중학교동창 시이모님댁 자랑중임ㅋㅋ
332	오감원 레스토랑	
333	갑을식당(함양)	
334	대웅	멸치쌈밥 대웅 우촌 육회 천엽 강추 검색 관광 기본 나들이 도회지 마당 맛집 목요일 부골 비빔밥 상세 상차림 실로 영남 오늘 대웅 대웅제약 크림다이브좀 피부 노화방지 제약회사 그립 쿠팡 라이브커머스 홈쇼핑 라이브방송 라방 크림 egf 콜라겐 공구 gsshop 쇼호스트 쇼핑호스트 오태훈 딘오 딘오마켓 초특가 에스테틱 이지듀 피부관리 젊어지기 grip coupang easydew
335	쌈촌구이&샤브	
336	청학산	한정식 식당 식객 맛집 허영 기행 인천 만덕 학산 음식 신청 함양군 아파트 코스 함양 횟집 갈비 부산 소개 강릉 광주 술기로운생활 술스타그램 먹스타그램 맛스타그램 콩잎곰국 청학산 함양청학산
337	신화루	멸치쌈밥 신화 고문 유니짜장 볶음밥 의정부 짬뽕 고추 맛집 면발 삼선 생각 선물 여자 환자 회원 가능동 김종우 다음 만두 선배 서울뉴우스_경기도..의정부에 경기도 가평 의정부 신화루... 서울맛집 경기도맛집 의정부맛집 의정부짜장면맛집 의정부중식맛집 가능동맛집 삼선볶음밥맛집 노포맛집 양주맛집 포천맛집 동두천맛집 서울뉴우스
338	바우석쇠	
339	늘봄가든(함양)	
340	예다믄	멸치쌈밥 도움말 복사 영상 광고 소요 이상 자동 재생 코드 트랙 화질 함양 가기 계속 공유소스 관련 광고정보 기능 기초 길이 예다믄 함양한정식 함양맛집 함양가볼만한곳 함양핫플 함양데이트코스 함양코스 함양힐링 경남맛집 맛집추천 함양가볼만한곳 함양핫플
341	농월초계탕	초계막국수 궁중한방오리 라이딩 참석 네이버 대구 지도 투어 경남 금원산 막국수 월초 지점 합류 가구 가정 기본 마눌 목적지 미리 부부 사항 바이크투어 바이크여행 온로드존 onroadzone 파워라이더 powerrider 바린이 바이크그램 바이크스타그램 r1200rt f700gs r1200gs bmwr1200rt bmwr1200gs bmwmotorrad 초계탕 농월초계탕 오토바이스타그램 이륜차 바린이의일상
342	레아모	스테이크스파게티 당신 하나님 우리 아도나이 하라 감사 찬양 할렐루야 바룩 하스 아타 이스라엘 복의 키레올람 주의 할렐루 모든 여호와 토라 베카 거창 의동마을 벚꽃 레아모
343	풍전복집	복매운탕 아르바이트 공휴일 구한 볼일 사장 시간 어제 일요일 전복 제공 풍전복집
344	거창복어	복매운탕 체험 당첨 거창 포스팅 반드시 방문 사항 예약 워드 작성 전화 후기 복어 기간 맛집 발표 복집 불가 추가 태그 거창복어 빠다롤뺑프랑스 빠다롤
345	애우전문점 거창축협한우팰리스	
346	쌍쌍식육식당	생삼겹살 경기도 식당 번길 칼국수 경상북도 경상남도 전라남도 강원도 충청남도 충청북도 본부 전라북도 지역 서울특별시 정식 두부 백숙 갈비 매운탕 전골 쌍쌍식육식당 소고기 먹스타 먹팔 선팔맞팔 좋아요 좋아요반사 인친환영
347	건계정	해물닭찜 거창 계정 삼계탕 미륵 어제 가격 계모임 군민 군청 그냥 근처 냇가 대비 도로 마리면 무엇 무지기 바위 반찬 사금 거창 거창군 거창여행 우정여행 청춘 자전거여행 그린씽 거창박물관 거창전통시장 건계정 창포원
348	삼산이수	갈비찜 주식 투자 세트 매매 이야기 공연 극단 실전 베팅 산이 포함 비밀 티켓 세계 프로 매도 시장 가지 선물 시스템 김천 삼산이수막걸리 삼산이수
349	외양간구시	한우생고기 맛집 경남 거창군 거창 거창읍 네이버 소개 식당 지도 요리 참고 카페 강남 강변로 거열 다우 라떼 밥상 보통 설렁탕 내고향 1박2일 엄마생일 아빠생일 생일인데맨날얻어먹기 거창소고기 거창애우 쑥먹인한우 외양간구시 최고맛집 거창가면꼭들러야하는곳 생일축하합니다 사랑합니다 포장선물까지잔뜩 부모님사랑 가족사랑 쵸리네밥상 쵸리네술상
350	옥계촌	한방백숙 백숙 추천 거창 계곡 막걸리 맛집 오리 옥계 이천 구미 김천 멀리 반년 블로그 사람 손님 오시 이제 주말 출처 이천 옥계촌 닭누룽지백숙 메밀전병누룽지백숙은
351	고래불해물찜	해물찜 해물찜 도원동 추천 가게 거기 배달 안나 이름 저녁 혹시 고래불해물찜 해물찜 맛있다 볶음밥킬포 해물사랑 해물이좋아 수다폭발 재밌다 날씨도좋고 기분도좋고 아무튼이래저래좋았던거야 행복 웃음포인트무엇 일상기록 데일리 수요일의행복 다이어트는내일부터 언제까지내일부터 물음표
352	파스타부오노(거창점)	
353	평사리한정식	한정식 대여 돌잡이 상차림 운영 게시 부동산 시대 용품 개인 검색 매매 원칙 카카오 한정식 거래 거사 관련 금액 내용 등록 포항맛집 포항한정식 포항상견례 포항돌잔치 평사리한정식 포항 포항맛집추천 포항여행 포항여행코스 포항맛있는집 포항한정식맛집 포항식당 한정식 한정식전문점 상견례장소 포항상견례장소 대한민국맛집 한정식맛집 존맛 먹방 먹스타그램 당일치기여행 꿀맛 여행스타그램 오늘의점심 맛집먹방
354	대식한우명가	
355	합천명품토종흑돼지	돼지고기 기호 돼지 토종 합천 느낌 명품 항정살 경북 고령 개실마을 계절의여왕 봄 신비롭다 벚꽃 설유화 수선화 합천맛집 합천흑돼지 합천명품토종흑돼지 무사히울산도착 어플카메라의힘 유라이크 스컹크웍스우정점
356	수미정식당	돼지고기 간장게장 맛집 추천 태안 가면 검색 난리 보고 식구 실망 여행 요즘 이면 재방 주말 지인 커서 수미정식당 소고기 갈비살 수육 좋은데이 jmt 제일떡방앗간 떡 주문떡 판매떡 참기름 미숫가루 방앗간 기타문의 잡일꾼 홍보중 공유 소통 경남 함안군대산면 대산면 떡맛집 홍보
357	백운식당	비빔밥 삼계탕 광양시 전남 주차장 백숙 합천 닭백숙 맛집 식당 광양읍 폭포 정보 능이 산행 황제 대장경 양호 캠핑 해인사 화장실 하이원 하이원리조트 정선맛집 하이원맛집 민둥산맛집 백운식당
358	당신이있어좋은세상	정식 마음 아래 제목 찾기 메일 사람 하늘 김유영 누군가 생각 서평 세상 쉼표 시간 요즘 우리 의원 잠깐 처음 표지 당신이있어좋은세상 가게이름이참좋네 경남합천군맛집 오리로스구이 국내출장
359	삼가명품한우	한우모듬 소고기 고해 명절 서양 이번 추천 택배 한우 한우육회 특수모듬 꽃등심 완벽한식사 삼가명품한우 한우먹는날 먹스타그램
360	황금나무숯불갈비	한우모듬 돼지갈비 양념 추천 택배 포장 합천 황금나무숯불갈비 갈비 삼겹살 고기 먹스타 맛스타 먹스타그램 맛스타그램 점심 먹그램 먹 food 주말 주말스타그램
361	참숯골	삼겹살 맛집 공기밥 기본 된장 삼겹 서비스 숙성 온도 음료수 이구 자동 직접 참숯 체크 합천 현지 참숯골 육회비빔밥 편맛집_무교동 편맛집_시청 편맛집
362	부자돼지	삼겹살 체험 당첨 포스팅 후기 사항 반드시 작성 돼지국밥 포함 방문 불가 예약 하단 기간 발표 워드 태그 맛집 여의도 전화 모든일잘돼지 부자돼지 행복하길바래 복 이쁜친구들이랑 행복 한국생활 한국생활 내인생
363	약천메기탕	메기매운탕 산성 마을 바위 갈림길 능선 우산 합천 의령 상투 이정표 새우 일대 지나 이듬 기우제 길이 사람 쌍백면 전망 하산 어젯밤흔적 약천메기탕 메기매운탕 노랑통닭 반반치킨
364	금호관	산채비빔밥 전라남도 금호 리스 상호 영암군 영암읍 음식점 한식 가능 길찾기 도크 맛집 메뉴 무리 백반 보기 스토리 시간 영업 오전 전남 영암군 영암읍 여행 맛집 드라이브 영암맛집 영암군청 주변 금호관 한정식 차림상 막걸리 영암막걸리 영암도포막걸리 생막걸리 한잔 냠냠
