	rstrt_name	final
196	초당돼지국밥	돼지국밥 수육 국밥집 사천 삼천포 자주 무지개해안도로 대포항 초당돼지국밥 나인뷰커피 cafe송정 카페인러쉬본촌점 박투어 장거리 3시간30분 녹초 ㅠㅠㅠ 안라 무복 좋아요
197	늘품한우	한우갈비살 한우갈비탕 사천 맛집 한우 추천 경남 삭제 새해 육회 특정 매집 단체 모두 붕어 비빔밥 사람 소고기 가족 거나 게시 게시판 사천맛집 늘품한우 한우모듬 육회비빔밥 비빔냉면 낮부터달렸다
198	아리랑	한우생갈비 삼겹살 각질 감사 관리 무시 미리 신랑 어마 추천 열린음악회 청와대개방특집 유채훈 정민성 라포엠 이무진 송소희 현음어린이합창단 청와대 현음중창단 횡단보도 아리랑 아기싱어
199	고쌈	삼겹살 김치찌개 도움말 복사 영상 이상 광고 사천 소요 자동 재생 코드 트랙 화질 간만 사공 스트레칭 워밍업 가기 경남 계단 계속 사천 고쌈 사천카페 라안카페 야외카페 분위기짱 우리가족 드라이브
200	파피쉪	목살필라프 수제돈까스 타파 파스 진주 블로그 작성 체험 금산 운영 후기 게시 마트 안내 금산면 진주시 개별 경력 경상남도 기간 내용 모집 짬낚하러 겁나 친절한 맛집 파피쉪 한그릇땡기기 요즘왜이래 불친절한데가 너무많아 우짤라고그라노 요즘시대에 ㅋㅋ
201	지명전골	해물탕 산낙지볶음 곱창전골 전골 가게 검색 곱창 공기 구이 네이버 넹맛 반찬 신랑 오늘 오우 저녁 전어 절대 지명 사천 사천시 사천맛집 곱창전골 지명전골 사천가볼만한곳
202	가람생복	복국 체험 쉬즈 포스팅 당첨 블로그 사항 포함 후기 기간 김해시 내덕동 맛집 반드시 발표 방문 불가 예약 워드 전화 추가 가람생복
203	가얏골감자탕(김해)	
204	갑오삼계탕	삼계탕 삼계탕 경남 창원 갑오 성산 맛집 약국 리뷰 무동 의창 국물 김해 상남동 종합 디아 생각 신월동 장유 초복 파라 갑오삼계탕 장유맛집 장유삼계탕 장유밥집
205	개성순대	순대 마산 맛집 창원 순대 추천 개성 가포 진해 생각 부탁 사람 전골 횟집 곱창 돈까스 리스트 상남 짬뽕 추가 갈비 산청 산청돌담 돌담식당 흑돼지참소라찜 구름그늘 삼천포대교 남일대해수욕장 가포개성순대 개성순대 순대전골가봐야지
206	백프로갈비	소돼지갈비 김해시 김해 맛집 경남 어방동 갈비 번길 인제 족발 백프로 택배 거래 고기 네이버 생신 직거래 한우 갤럭시 냉면 닭갈비 김해맛집 김해소고기맛집 백프로갈비 100%갈비 생갈비살 안창살 소고기는진리입니당~~♡ 개인방갈로 코로나조심 참숯 한우 진로 소주사랑 냉면 된장찌개 간만에콧바람 한우그램 소주그램 먹방 먹스타 화이트데이 주말 일상 소통 선팔맞팔
207	생우림	등심 김해 맛집 추천 정식 김치찌개 전문점 돼지 뷔페 식당 갈비 고기 배달 족발 반찬 한우 국밥 김치 메뉴 본점 오리 주말 토요일 점심 소고기 김해 생우림 맛집 꽃등심 모듬 냉면 된장찌게 맛점 맛있다그램 룸으로 놀이터도있고 좋아요 좋아요그램 일상
208	석정숯불갈비	소돼지갈비 갈비 석정 숯불 길찾기 돼지갈비 보기 수정동 신포 울산 중구 추천 크게 하나 곽남 광역시 굿굿 남외동 동구 돼지껍데기 맛집 부산 수정동 석정숯불갈비 뒷고기
209	솔향오리농원	오리구이 오리 친정 닭백숙 마리 백숙 솔향 오리고기 공기밥 구이 김해 끼리 농원 마심 맛집 먹음 사이다 생신 소주 아버지 아부지 솔향오리농원
210	장보고횟집	생선회 상견례 격식 식사 요즘 장소 추천 카페 한잔 호텔 아빠 친정식구 일상 세살아기 저녁 장보고횟집 광어 해산물모듬 이번이
211	정림	약선한정식 돌잔치 김해 돌상 정림 한정식 소규모 산정 진행 출장 스냅 사진 체험 후기 가족 한복 컨셉 나무 행복 셋팅 준비 학고재아트센터 삼청동 정림&간삼 어린이날
212	포크밸리로스트	
213	동화반점	중화요리 구합 경력 칼판 급여 휴무 면접 반점 보험 전화 가능 가입 밀양 시간 연락 저희 중식 초보 평일 협의 면장 팔보완자 해물팔보완자 탕수육 돼지고기탕수육 동화반점 동대문중국집 동대문중화요리 공룡알 동대문공룡알 서울에서제일오래된중국집 먹돈버동대문 동대문역중국집 동대문역사문화공원중국집
214	서울삼계탕	삼계탕 삼계탕 밀양 서울 고생 보양식 엄마 여름 친정 서울삼계탕
215	옥수정가든	메기탕 백숙 동창회 시간 옥수 정가 참석 총무 회장 가슴 가정 경남 김정식 다음 대신 대표 마음 모습 밀양시 박용희 부회장 분위기 부산 부산한우 광안리 광안리맛집 점심특선 우토피아 주누파파 주누파파광안리 주누파파한우 주누파파점심특선 옥수정가든
216	일자봉	한우갈비살 영상 도움말 복사 자동 광고 소요 이상 재생 코드 트랙 화질 자봉 밀양 시간 최우근 주소 번개 후기 가기 계속 산행스타그램 산스타그램 등산스타그램 등산 산 겨울산행 한국의명산 산행 등산체력키우자 일월산정상 월자봉 일월산해맞이공원 뚱스님 일자봉 주말산행 눈산행하고싶다
217	입소문 맷돌 순두부	
218	청수정	메기탕 장어구이 민물장어 밀양 수정 식당 동동주 매기 매운탕 불리 오늘 장어 직접 청수정 홍합밥 북촌 맛있는밥
219	한방바다장어구이	장어곰탕 장어구이 사장 구합 바다 사항 삼문동 시간 알바 연락처 오후 음식점 장어구이 전화 주심 밀양맛집 밀양맛집추천 밀양예림 상남면맛집 한방바다장어구이 밀양장어 한방장어 장어5인분 밀양한방바다장어구이 한방장어구이 밀양장어구이맛집 밀양예림맛집 밀양한방장어숯불구이 불토 2018신년회 밀양댁 맛스타그램 먹스타그램 술스타그램 소맥 알콜키티 장어키티 불끈불끈
220	고궁식육식당	식육(숯불구이) 배달 가능 갈비 고궁 택배 거제 국밥 사용 상품권 식당 전국 지역 카드 포장 갈비탕 강한사 거리 거사 거제도 구인 여덟살문채운 어버이날 고궁식육식당 브리틀리 중곡동 거제 거제가볼만한곳
221	웨딩블랑	
222	다미정숯불갈비	식육(숯불구이) 가족 운영 임산부 할인 갈비 양념 업데이트 자녀 중곡동 거제 다자 맛나 보육 복지 사항 시청 업체 참고 추천 출산 맛집 번데기탕 중곡동맛집 갈비맛집 다미정숯불갈비 흥하새오
223	황금고디탕	한식 맛집 거제 거제도 정보 추천 공유 세포 호흡 옥포 카페 광고 근처 다이빙 대명 디탕 멤버 아시 장승포 칼국수 통영 소통 선팔하면맞팔 맞팔 거제 거제도 거제여행 거제장승포맛집 장승포맛집 거제장승포 황금고디탕 장승포황금고디탕 거제장승포황금고디탕 거제장승포 거제맛집 거제핫플 거제도맛집 거제카페 거제도카페 거제가볼만한곳
224	그바다에 가면	
225	박정현게장백반	한식 맛집 거제도 거제시 경남 게장 일운면 네이버 세포 지도 거제 순위 정식 해물 해안로 간장게장 구조 꼬막 남편 듬뿍 바람 일상 daily 여행 가족여행 양산 부산 거제도 거제도여행 가족 장승포 몽돌해수욕장 박정현게장백반 전복장 새우장 양념게장 간장게장 한식맛집 거제도맛집 foodtopic 맛스타그램 밥스타그램 foodstagram 좋아요 셀카투척 보트투어 해금강 바람의언덕 여름여행 갤럭시 갤럭시s20
226	썬바다횟집	회집 횟집 거제 김해연 바다 해금강 거제시 국회의원 낚시 동생 맛집 발전 연송 후보 거제도 게임 기호 사이즈 인연 인준 전갱이 거제 해금강 바람의언덕 아버지환갑여행 여름휴가 썬바다횟집 칠성사이다
227	거제으뜸횟집	생선회 거제 배달 시작 으뜸 코로나 횟집 기타 때문 방지 식당 예상 오기 옥포동 위해 중대 현금 확산 거제여행 거제맛집 여행은역시먹방 거제으뜸횟집  활어회 거제횟집 생선구이맛집 구조라맛집 구이조아라 거제생선구이 대맛존맛 대박맛집 물회 찢었다 다시생각나는맛집 맛집추천
228	지중해	한식 관광 마을 거제 단지 지중해 조성 개발 관광객 장목 축제 독일 또한 남해 랜드마크 문화 유치 위해 지역 통해 거제도 터키여행 카쉬 지중해
229	용화횟집	생선회 횟집 거제 맛집 거제도 물회 식사 자연 추천 조개 캠핑장 바다 음식 거제시 고집 사등면 스끼다시 아주 우럭 정말 주문 리온이의여행기록🐟
230	외포9번횟집	생선회 거제도 구합 대명 멸치 실장 추천 가도 거제 게시 고민 대리 때문 리조트 모레 문자 보신 수영 식당 신분 쌈밥 거제 예이제게장백반 하면옥 외포9번횟집 외도널서리 회무침 멸치회무침 멸치튀김 멸치찌개 간장게장 양념게장 간장새우 뽈락구이 칼국수 냉면 육전 까페 밀크티 레몬타르트 티라미슈 여행 먹스타그램 맛스타그램
231	외포등대횟집	생선회 횟집 등대 맛집 멸치 사진 조개 간다 밑반찬 보기 아주 여행 우럭 저녁 정말 추천 파도 가자미 가지 거기 경기도 거제여행 외포등대횟집요즘 멸치튀김 멸치회무침 멸치조림 도다리쑥국 건대구탕 거제민박 거제숙박 해.맑음펜션 포로수용소 거제펜션 거제도숙박 거제도펜션 거제도민박 거제도맛집
232	효진수산횟집	생선회 거제 멸치 멍게 대표 바다 백종현 기자 대구 요리 경남 맛집 외포항 부산 치킨 횟집 식당 거제도 메뉴 봄멸 삼선짬뽕 외포항맛집 장애인접근가능식당 휠체어접근가능식당 효진수산횟집 대구회 대구정식맛집 거제도맛집 천성항 천성항조형물 천성항은변신중
233	옥포막썰이회해물	생선회 가격 거제시 경상남도 소명 쥐치회 방어회 옥포막썰이회해물 losintocablesmalbec
234	계룡산숯불갈비 장승포점	
235	세야촌	식육(숯불구이) 구합 시청 주방 나이 마감 문자 평일 가능 기재 날짜 면접 서빙 성함 세용 시간 연락 오픈 오후 월금 일요일 20181129목요일 세야촌음... 일상 거제 거제줌마 거제줌마그램 거제남매 거제남매그램 거제맛집 맛집그램 거제쌈밥 거제시청맛집 세야촌 이제안녕
236	대원군숯불갈비	식육(숯불구이) 갈비 대원군 숯불 오후 고현 명상 싱잉볼 아르바이트 요가 구합 수업 전화 학생 급여 서빙 주시 협의 후반 거제 거제시 찍고찍고또찍고돼지갈비는 대원군숯불갈비 거제맛집 고현동맛집인셀덤 피부참좋다 어플카메라
237	수원왕갈비	식육(숯불구이) 거제 여행 갈비 맛집 멸치 수원 쌈밥 가시 근처 남쪽 대명 리조트 만점 숯불 영양 저녁 점심 주말 추천 변호사 김시영변호사 형사전문변호사 손해배상전문변호사 돌곤이 돌곤투어 수원화성 화홍문 장안문 용연 홍이포 수원왕갈비 본수원갈비 수원구치소 변호인접견 은돔이💕
238	보리네생고깃간(고현점)	
239	맛찬들왕소금구이 옥포점	
240	수산시장	일식 수산시장 거제 바다장어 장어 가상 구매 상태 소매물도 정말 후기 고기 이번 주문 최고 추천 캠핑 택일 가시 가족 마무리 citiesskylines citiesskylinegame citybuilder pcgaming koreancity seafood 수산시장 fish
241	고현장어	한식 고현 장어 연구소 연락 완료 추천 가까이 구인 구합 신분 요망 장어구이 저녁 개강 거제 내일 대학생 모임 문자 번호 거제도 고현장어 거제도장어구이 장어구이 장어한마리 맛집 맛집스타그램 맛집추천 맛집그램 맛집탐방 먹스타 꿀맛 먹방스타그램 먹스타그램 food foodie instafood foodpic foodpics foodporn foodstagram foodlike hotplace
242	남다른감자탕고현점	한식 과외 개인 제재 참고 교습 도배 가능 게시 내용 등록 벌금 사용 사항 신고 아이디 업체 운영 원칙 인시 적발 거제도맛집 거제도가볼만한곳 거제도핫플레이스 거제도핫플 거제도감자탕 감자탕 거제도여행추천 거제도여행필수코스 거제도밥집 거제도맛집추천 남다른감자탕 남다른감자탕고현점 거제도남다른감자탕
243	고현횟집	생선회 미더덕 횟집 고현 진동 초등학교 하나 거제 학교 보기 아이 진동항 마음 바다 봉투 생각 제법 지금 거제시 경상남도 국회의원 창원맛집 진동맛집 고현횟집 봄을 미더덕회 미더덕덮밥 오만둥이 장아찌 맛나 맛집 봄만 기다리다 또먹으러가자.
244	한우포차식육식당	
245	장수녹각삼계탕(덕계동)	
246	종정헌	영양돌솥밥 맛집 추천 전문 양산 정헌 식당 칼국수 굴비 보리 장전동 돌상 돼지국밥 식사 아구찜 곱창 돌잔치 만두 전문점 연산동 화명동 20220214엄마랑 점심 종정헌 꼬막비빔밥
247	경원궁&미나미	
248	범어가마솥	
249	어드메	훈제오리 양산 어드메 가격 구이 단호박 맛집 오리 훈제 양산밥집 가성비밥집 오월식탁 청연식당 초밥정식당 어드메 양산맛집 양산가볼만한곳 양산분위기좋은곳 양산여행 물금맛집 양산증산맛집
250	청해대복	복매운탕 매운탕 지리 나름 맞은편 반찬 보조운동 복국 양산 오늘 운동장 위치 은복 이지 종합 주차 주차장 청해대 타이어 한국 해장 힐링타임 청해대복 북안남1길31 양산맛집 양산복집 밀복 까지복 생복 참복 은복 지리 매운탕
251	조방낙지(양산)	
252	죽림산방	양선요리 선생님 양산 죽림산방 고등학교 음식 정당 진보 카페 교육 녹색당 녹색평론 데이 도자기 매우 바로 상호 선거운동 식당 와이프 운동 오늘은날씨가다함☀️ 죽림산방 뷰맛집 잠시힐링중 하늘너무이쁘다 활짝핀너도이쁘다
253	신라해장국(양산)	
254	화림초밥	회초밥 준비 결혼 가장 공간 부산 사진 소개 신혼부부 정보 개월 검색 게시판 결혼식 고난 공부 기억 끝내 날짜 놀이터 단계 화림초밥
255	대보름생아구찜	아구찜 체험 아구찜 포스팅 후기 쉬즈 작성 내용 당첨 링크 매장 반드시 불가 블로그 사항 하단 구비 기간 대보름 발표 소독제 대보름생아구찜 맛집 아구찜 내사람 내사랑 찐행복 인셀덤송혜주 인셀덤히트 인셀덤정승혜 인셀덤아트 인셀덤황재선 아직미정
256	송강민물매운탕	민물매운탕 매운탕 민물 양산 추천 더욱 두산 맛집 부근 위브 이면 정말 친정엄마 양산 송강 매운탕 ..외할머니집 양산맛집 송강민물매운탕 매운탕맛집 인생맛 인생맛집 먹스타 맛스타 먹스타그램 맛스타그램 존맛 존맛탱 맛집 선팔 맞팔 선팔하면맞팔 좋아요 데일리 일상 인스타푸드 food foodstagram likeforlikes likeforfollow followforfollowback likeforfollow yummy yummyyummy
257	진송추어탕(양산)	
258	진부령황태구이	황태구이 수영구 부산광역시 번길 황태 칼국수 반상 휴게소 광안동 구이 국밥 남천동 망미동 진부령 밀면 비빔밥 남천 된장찌개 비빔 서울 수영로 양산맛집 양산통도사맛집 진부령황태구이 통도사맛집 황태찜 황태구이통도사
259	금오암소한마당	소고기 맛집 의령읍 식당 의령 거창읍 방송 소바 의령군 대의면 한식 함양읍 거창 산청읍 시천면 요미 함양 국밥 금서면 메기 본점 금오암소한마당 합천맛집 의령맛집 진주맛집 소고기맛집
260	솔밭가든	불고기 게시 게시판 경우 작성 강아지 규칙 나들이 대상 양식 위반 장소 데리 소개 우리 이용 특정 함안 가든 가족 강제 임신10개월 만삭 조카 딸바보 처가집 나들이 당진맛집 솔밭가든 볼트ev 전기차 주말스타그램
261	국보삼계탕	삼계탕 무학산 미련 설악산 예약 장복 저리 취소 함안법수 코로나19 함안맛집 국보삼계탕 함안산인맛집 함안산인
262	나룻터가는길	
263	신풍식육식당	한식 냉면 함안 식당 풍식 육수 고기 도착 만두 맛집 사람 신랑 정말 함안군 곱빼기 날씨 냉면집 물냉면 법수면 보통 비빔냉면 냉정한미식가 냉면덕후 면식기행 함안냉면 비빔냉면 함안맛집 별점3점 신풍식육식당
264	사랑채(함안)	
265	양평해장국(함안)	
266	낙동강 칠백리	
267	큰손짜장	짬봉 대산 맛집 짜장면 공유 바삭 잠깐 정보 친구 탕수육 혹시 큰손짜장 하루알바중 콩국수개시 주문실수 사천탕수육 전가복 물만두 일하는와중에도 배터지게먹는중
268	판문점숯불갈비	돼지숯불갈비 갈비 음식점 맛집 백년 양념 입맛 자존심 전국 점포 호점 가게 가능성 가운데 검색 경남 고객 고기 공식 국내 대부분 창원맛집 마산맛집 숯불갈비 냉면맛집 판문점숯불갈비 물냉면 비빔냉면
269	참하누	소고기구이전문점 소고기 맛집 식당 가격 가성 개조 걱정 경기도 계세 고기 길찾기 보기 사람 상차림 새벽 스타일 심지어 양동 양주시 예약 고현맛집 참하누 고기맛집 신선한재료 다맛있어 뭉티기맛집 대박나세요 넉넉한인심의사장님
270	가얏골감자탕	김치감자탕시래기감자탕 창원 해장국 근처 동생 맛집 밥집 성산구 의창구 일도 장수 진짜 집도 최근 추천 찰리미식회 찰미 연대하고또연대하라 남천동 남천집앞건물 가얏골감자탕
271	고궁	청국장 오리불고기 임시 미정 박물관 위치 서울 경기도 도서관 강원도 경상남도 경상북도 정휴 전라남도 부산 제주 문화 특별자치도 전라북도 서울특별시 한국 미술관 seoulpalace sameplace 4seasons 4pics 아름다운우리고궁 우리고궁 고궁산책 고궁의사계 창경궁 Changgyeonggung 昌慶宮 네장의사진 四枚の写真 고궁 古宮
272	금별식당	아구찜추어탕 삼계탕 정지 활동 광고 리지 비방 삭제 새싹 카페 간주 간판 감솨 거짓 공개 구경 달기 댓글 등급 링크 말기 금별식당 HBD 사랑♡
273	도리원	장아찌 우르 도리 창녕 수맥 터미널 식품 미션 산소 귀농 구미 기업 단지 지역 감정 장아찌 대구 안동 정기 주차장 풍수 부산순두부맛집
274	북면자연농원	오리불고기 오리탕 오리탕 식당 경기도 번길 자연농원 칼국수 북면 오리 경상남도 경상북도 전라남도 맛집 강원도 충청남도 충청북도 진주 본부 전라북도 서진 주점 맞팔 먹팔 오리백숙 대구맛집 대구찐맛집 소통 대구현지인맛집 현풍맛집 달성군맛집 백숙추천 북면자연농원
275	서울식육식당	소갈비살산채비빔밥 대구 서울식 식당 치킨 모임 겨울 결과 때문 매출 배달 소고기 여름 장소 추천 한우 간단 고객 고기 공무원 김치찌개 서울식육식당 먹스타그램박거이 일상소통환영 먹팔맞팔해요 소고기먹방
276	석정숯불갈비	숯불갈비 갈비 석정 숯불 길찾기 돼지갈비 보기 수정동 신포 울산 중구 추천 크게 하나 곽남 광역시 굿굿 남외동 동구 돼지껍데기 맛집 부산 수정동 석정숯불갈비 뒷고기
277	양반청국장	청국장 전문점 창녕 산행 화왕산 순두부 억새 자하 청국장 거리 경남 도시락 맛집 습지 양반 업체 여행 우포늪 장관 정상 찌개 참석 이루마 금요일밤 3차접종 아들의꿈 이루마 양반청국장 일하는엄마
278	양평해장국(창녕)	
279	우포한우프라자	한우숯불구이 및 갈비탕 설전 강남 거의 등등 밥집 시댁 식구 오리 장사 초우 추천 우포한우프라자 대구여행 오빠친구찬스 한우 꿀맛 육회비빔밥도못찍었네 냉면도못찍엇네 삼성온천호텔 유황온천 부곡 온천여행 키즈디럭스
280	조선옥삼계탕	삼계탕석쇠불고기 영광 맛집 조선옥 중앙시장 검색 계심 골목 기대 메뉴 사시 삼계탕 서우 여기 음식 이번 일욜 전남 주변 주차 추천 사우나온줄 몸보신 삼계탕 요즘야구안보신다더니아빠는풍각쟁이 아빠표맛집 조선옥삼계탕 목포맛집 기록
281	주왕산삼계탕	삼계탕 삼계탕 창녕 포장 대구달서구여행 달서구맛집품질 약수삼계탕 주왕산삼계탕문의 인스타그램 인스타 대구가좋다 여행스타그램 여행을떠나요 여행에미치다 여행을떠나다 여행을일상처럼 여행자 여행 여행이좋다 여행은사랑입니다 대구여행중 달서구여행 강영대주왕산삼계탕 맛스타그램 맛스타 먹스타 먹스타그램 삼계탕 삼계탕스타그램 삼계탕맛집 삼계탕그램
282	진짜순대집	순대전골 모듬순대 순대 속초 오징어순대 맛집 아바이순대 전골 진짜 내장 대국 아바이 음식 창녕 국물 때문 순대집 여기 주문 가게 기분 김치 윤이나는피부샵 채움미가대구점 연말파티 송년회 울친구 생우럭탕 무침회 월남쌈 불고기초밥 잡채 진짜순대 상인동 진짜순대집 2017년 2018년도...전부대박나고
283	창녕대가	한우쇠고기된장찌개 기름 사용 삼겹살 제품 종이 청소 모닝 사진 아트 한우 호일 가운데 경남 고기 고이 광종 구울 구입 기도 대가 즐거운식사시간 창녕대가 한우맛집 꼬기꼬기 6살2살남매 세젤예
284	통일냉면	냉면 참석 안내 출사 회비 냉면 고성 맛집 정기 집결 통일 경남 고성군 댓글 만화 방초 사항 수국 아시 장소 점심 통영 고성 고성맛집 고성핫플 고성카페 통일냉면 회냉면 만두 고옥정 한옥카페 베이커리카페 바다뷰 뷰맛집 흑임자라떼 연탄케이크 바질크런치 언제나 취향저격 일상 커피타임 금요일즐기기
285	하나비	생선회모밀국수우동 배달 부곡 유통 청과 장소 휴가 각종 결제 경봉 계좌 공지 과일 기재 남지읍 노력 다행 대행 댓글 매부 모두 피아노 뉴에이지 피아노스타그램 히사이시조 하나비 hisaishijoe piano pianomusic pianocover claasic newagepiano chopin
286	화덕본가	돼지갈비 대출 상품 매출 투자 사용 펀다 담보 본가 카드 한번 화덕 매출채권 플랜 세이브 신용 이번 장래 차주 코로나 크게 월화수고기 화덕본가 후식만땅좋음 포장된아이스크림 무료라니 한우촌 된장밥 다드림 냉면죠하 당분간저녁외식금지
287	황부자숯불갈비	한우등심지리산흑돼지 맛집 부곡 아시 가야 근처 스테이 키즈 황부자푸드 하와이갈비 프로갈비 아마갈비 돼지갈비 갈비 양념돼지갈비 양념갈비 캠핑 외식 식사 가족 집들이 초대 돼지갈비맛집 먹스타그램 맛스타그램 갈비맛집 저녁메뉴 집밥 부곡하와이 부곡온천 황부자숯불갈비 tvN 프리한19 그때를아십니까 1위 창녕맛집 부곡맛집
288	창녕한우	한우전문 경남 특산 김해 박람회 업체 참가 창녕 가능 거제 꼬리 밀양 벌꿀 이벤트 인증 잡기 장군 후기 개최 경상남도 계정 화왕산한우 창녕한우 창녕정육점 창녕소고기 무항생제한돈 건조숙성육 육사시미
289	공룡알	생선회 공원 박물관 마을 자연휴양림 파크 서울 경북 생태 계곡 테마 경기 해수욕장 전망대 미술관 강원 국립 문화 수목원 체험 폭포 베이킹소다공룡알 공룡알 31개월아기 4세놀이 엄마표놀이 베이킹소다놀이 과학놀이 초간단놀이 집에서놀아요 또또엄마❤
290	늘봄가든(고성)	
291	대가저수지가든	돼지불고기 구함 보조 주방 가든 결정 고성읍 급여 대가 면접 바로가기 오전 운행 저수지 차량 출퇴근 경남고성 대가저수지가든 pic photography photo 사진 사진계정 폰카 사진초보
292	바닷가에햇살한스푼	스파게티 피자 파스타 고성 바닷가 스푼 햇살 맛집 카페 메뉴 바다 필라프 새우 생각 피자 경남 시간 오늘 조금 주문 주차 건너편 일상 엄빠랑데이트 통영 고성 주말 바닷가에햇살한스푼 벚꽃놀이  드라이브  소통
293	새로운통일냉면	냉면 갈비찜 참석 안내 출사 회비 정기 집결 경남 고성 고성군 댓글 만화 방초 사항 수국 장소 공지 마감 보드 사진 시간 고성맛집 새로운통일냉면 더울때는냉면 인생냉면 회냉면강추
