	rstrt_name	final
0	낙지천하	낙지전골 낙지복음 맛집 북면 배달 음식 추천 낙지 시골 음식점 진짜 기력 다음주 무동 세명 소개 아부지 요즘 용포탕 이사오 천하 최고 창원마산 창원 마산 창원북면 북면천주로 북면점심 낙곱새 낙곱새비빔밥 소중한사람과함께 수다떨기 오늘도 역시 즐거웠던시간 낙지천하
1	가마솥추어탕	추어탕다슬기탕 추어탕 북면 맛집 추천 다슬기 가마솥 들깨 밥집 국물 포장 한해 간이 거마 공유 근처 김해 나이 나흘 노래 눈독 3대째가마솥추어탕밀양이다 부산방랑자 전국방랑자 방랑자 추어탕 추어튀김 가마솥추어탕 시골풍경 밀양맛집 수산리 방랑_3대째가마솥추어탕 방랑_밀양맛집 방랑_추어탕
2	경호강메기탕	어탕국수메기매운탕 창원 맛집 마산 진해 생각 어탕 추천 횟집 곱창 돈까스 리스트 상남 짬뽕 갈비 국밥 국수 모두 불고기 아구찜 어디 어탕국수 명서동 경호강메기탕1년뒤엔
3	국일성	중화요리 추천 창원 근처 맛집 시티 유니 음식 중국집 가족 계동 도로 마구 메뉴 모임 배달 부산 식당 직진 집들이 참고 간짜장 국일성 창원 chinese cuisine
4	금화	중화요리 금화 식당 용동 창원 노포 동남 중국집 회관 가능 고추 꽃빵 네이버 누구 라면 리극강 마지막 맛집 배달 보신 사람 기념주화 금화 은화 CommemorativeCoins_DPRK puregoldcoin puresilvercoin coingold coinsilver Coin
5	기장대게	대게 번호 검색 기장 다른 대게 도매 용호동 전화번호 창원 부산여행 부산가볼만한곳 부산대게맛집 부산맛집추천\u2063 기장맛집 기장시장대게 기장맛집\u2063 부산기장맛집 부산맛집 기장대게 기장대게맛집\u2063 부산대게
6	남해일식	초밥생선회 남해 맛집 일식 창원 추천 물회 식당 가보 가족 갈수 같고룸 개인 공간 군데 모시 별도 부탁 삿뽀로 상관 상남동 남해여행 너와나의꿈 제철생선 남해맛집 남해일식 미조항 예약필수
7	동해해물탕	해물탕 고니 하나로마트 파라다이스시티호텔 인천 호캉스 지워니그램 8개월아기 246일아기 가족여행 파라다이스맛집 라스칼라 트러플피자 임페리얼트레져 또가고싶네 동해해물탕 해물탕맛집 아구찜도먹고 햄볶아요
8	송림정흑염소구이	흑염소구이 염소 구이 기력 보아 보충 여름 음식 전골 주차 백숙 영양 오리 창원시 가격 경남 경상남도 고혈압 꼼장어 날씨 노곤 LPbar drumbar 드럼바 유열님도 삼촌한테들어서알아요 창원바 창원카페..용지호수 검색해도안나옴 송림정흑염소구이 bose901 speaker rockmusic
9	박영수손짜장	자장면 짜장 맛집 창원 박영수 추천 탕수육 역시 이상 자장면 중국집 짜장면 출연 가게 가격 각종 데이트 메뉴 사진 요리 이름 박영수손짜장다음엔 매운짜장 거제박영수손짜장순천
10	백제계삼탕	삼계탕 맛집 미리 백제 삼계탕 용호동 점심시간 주문 창원 가시 건강 고추 공간 국물 국산 국수 기본 기피 김치 달라 드라마 먹스타그램 백제계삼탕 송가네한우탕 장원막국수 똥꼬 육회본가 명동할매곰탕
11	생초메기탕	메기탕 어탕 국수 맛집 마창진 만난 메기 생초 수고 수다 어디 왓어 용동 친구 탕집 창원 생초메기탕 메기매운탕 어탕 먹스타그램 맛스타그램 instafood foodporn foodie yummy JMT 먹방 오늘뭐먹지 먹부림 직장인 점심 lunch 점심메뉴 일상 데일리 daily fff f4f l4l
12	석정한정식	한정식 한정식 창원 추천 내일 맛집 모시 식사 어디가 어른 제발 협찬오늘은 진해 진해맛집 용원 용원맛집 석정한정식 한식 한정식 집밥 집밥메뉴 보리굴비 굴비정식 청국장 육전비빔밥 비빔밥 음식 먹스타그램 먹방 음식 맛집 맛집추천 맛집투어 팔로우 좋아요 맞팔해요 f4f foodstagram
13	성심농장가든	백숙건강탕 백숙 감사 마산 말복 맛집 미리 오늘 창원 추천 혹시 가족 삼남매 북면 성심농장가든 수산 카페13월 뷰
14	생포갈비	양고기 양꼬치 맛집 돌싱 클럽 갈비 곡동 구글플레이 김경 닉네임 모임 방도 본인 비상 상권 상담 생포 성별 소개팅 소송 신청 싱글 생포갈비 알탕 소세지야채볶음 비빔밥 샌드위치(With 먹방 캠핑먹방 캠핑음식 캠핑안주 먹캠퍼 캠핑요리 캠퍼 캠핑장 캠핑맛집 캠핑 캠핑스타그램 가족캠핑 가족캠퍼 육아소통 일상스타그램 육아스타그램 camping 음식스타그램 먹스타그램 가마보코3L 비바돔 색캠69⠀⠀⠀⠀⠀
15	소반(팔용동)	
16	수제갈비 창원중동점	
17	유정숯불갈비	갈비류 갈비 칸막이 느낌 유정 인테리어 테이블 맛집 우드 감각 계동 소파 외관 창원 가게 가구 나무 돼지갈비 뒷쪽 모습 백라이트 창원갈비 창원고기집 유정숯불갈비 바람홍님맛집투어중에 먹방 먹부림 먹스타그램 맛스타그램 맛집여행 먹팔 먹팔맞팔 먹스타 먹친 선팔 일상기록
18	이바돔감자탕(용호동)	
19	임진각식당(팔용동)	
20	장독옛날손짜장	중국음식 김해 정보 시민 카페 게시 맛집 센터 수타면 인력 일용직 장독 게시판 경우 공유 광고 광장 구인 구직 국물 대산면 중국집 장독옛날손짜장 짜장면 짬뽕 삼선짬뽕 주남저수지맛집 창원맛집 창원중국집 창원장독옛날손짜장 점심 창원대산면맛집 맛 맛그램 맛스타 맛스타그램 먹그램 먹스타그램 먹스타 먹방 먹방스타그램 맛집 맛집투어 맛집추천 푸드 인스타푸드 일상 일상그램 일상스타그램 일상소통 맛있어
21	전원아구찜	아구찜 용동 주위 근처 넝숭 도계 부디 석고 요즘 찜맛 찜집 추천 마산어시장 마산아구찜거리 원조진짜초가집 박영자 전원아구찜 옛날우정아구찜 진짜아구찜 마산전통아구찜 옛날진짜아구찜 초가아구찜 고향아구찜 금관찜 진짜아구아지매 옛날원조꽃개찜 진짜초가원조아구찜 농원식당 여로찜집 개미아구찜 마산맛집 오동동문화거리 창동예술촌 마산수변공원 부림창작공예촌 마산3대객주 환영수산김한영 대동수산최수동 제일수산전삼도
22	전통순대촌	순대국밥 맛집 북면 추천 창원 온천 식당 순대 가게 국밥집 국집 그릇 마산 메뉴 볶음밥 불고기 사장 설렁탕 전골 전통 정식 북면맛집 창원맛집 전통순대촌 순대구이 순대전골 볶음밥.예전부터
23	정운각	고기요리 남방 동읍 모임 정모 정운 회원 가물 생각 참석 가락 검토 곳도 기억 다른 다음주 댓글 마지막 만남 모두 모든 남자친구 럽스타그램 데이트 김천 김천아포 아포 김천데이트 김천아포데이트 정운각 존맛 존맛탱 맛집 김천맛집 김천아포맛집 아포맛집 짜장면 짬뽕 간짜장 해물짬뽕 짜장면맛집 짬뽕맛집 간짜장맛집 해물짬뽕맛집 세상맛있음 맨날 먹기 옆집맛집 최고
24	주남오리궁(동읍)	
25	주남오리알	오리요리 맛집 리알 오리고기 마지막 저녁 저수지 남오 도착 수업 아버지 절반 창원 가지 경남 고추 그릇 근처 기념 나들이 날씨 주남저수지맛집 주남오리알 주남 DOLADOLA 돌아돌아 보물찾기 여행 맛집 로컬맛집 창원맛집 동읍맛집 청둥오리 오리고기 오리전골 창원 동읍 어버이날 보양식 창원가볼만한곳 주남저수지 주남저수지맛집 효도 모임장소 어버이날음식 메뉴추천 koreatravel visitkorea
26	중동식당	찜류 맛집 창원 추천 부모님 거리 게장 고갈 멀리 모시 물런 시티 식당 유니 제외 종류 주변 중동 칼국수 코로나 평일 실시간재성맛집 실시간재성 실시간재성_의령 실사간재성_경남-🐮 경남맛집 의령맛집 의령여행 중동식당 소고기국밥 곰탕 의령한우 의령핫플
27	청풍갈비살	갈비류 갈비 기름 명륜 창원 북면 북면온천 북면온천맛집 갈비맛집 청풍갈비살 소갈비 돼지갈비 존맛ㅈ
28	판문점(팔용동)	
29	푸주옥(창원)	
30	할머니국밥집	
31	함양옻닭명곡점	삼계탕 옻닭 맛집 몸보 신용 창원 추천 한번 네이버검색함양옻닭 방풀 홀가득 함양옻닭진해점 함양옻닭명곡점 함양옻닭부산하단점 함양옻닭굴화점 함양옻닭언양점 함양옻닭광주점 함양옻닭거제점 함양옻닭상남점 울산맛집
32	해신식당	모듬회 용동 추천 해신 횟집 가보 강태공 모시 초밥 가족 감사 검색 계동 계세 근처 나나 나름 메뉴 모임 미리 미정 여행 추천 힐링 좋아요 행복 맛집 강원도 영월 청령포 선돌 김삿갓 해신식당 followme likeforfollow instadaily instagram instagood 선팔환영 맞팔환영 선팔하면맞팔 맞팔해요 좋튀 소통해요
33	해훈식당	민물회 물회 저수지 겨울 근처 남동생 내일 민물 지금 추천 혹시 회도 용봉탕 배부름 몸보신 해훈식당
34	향우본가(식육식당)	
35	남다른감자탕	감자탕 감자탕 배달 포장 닥치고 성산구 실만 이후 집중 추천 코로나 한번 해주 혹시 남다른감자탕추운날
36	소정숯불갈비	돼지갈비 삼겹살 갈비 돼지갈비 고기 계동 맛집 소정 양념 의창구 이면 가성 공휴일 기름 냉면 다생 달리 돼지 마산 모든 방법 불판 퇴근길 저녁 돼지갈비 숯불갈비전문점 소정숯불갈비 도계동맛집 창원맛집 진로참이슬 무학화이트 도계동 의창구 창원 상남동 경상남도 대한민국
37	비비돈까스	돈까스 맛집 돈가스 창원 비비 추천 용동 유니 가게 고기 돈까스 비빔밥 서상동 안심 이상 주변 중동 까페 데이트 메뉴 모집 서울 주한미국대사관 스타벅스 광화문 돈까스 비오는날 사람너무많아 광화문에서 복잡함 비비돈까스
38	곰애	설렁탕 설렁탕 곰내 곰탕 김치 깍두기 다다 마음 부터 사진 시간대 아쉬움 아침 영업 월요일 자알 조금 창원 토요일 휴무 곰애 특곰탕 양탕 곰탕 국밥 일상그램 불금 하얗게 불태웠다 창원 맛집 글라스 소주 대선
39	매화다찌	일식코스요리 할인 가능 방문 상남동 판매 포장 때문 모두 상황 생물 시간 예약 코로나 화일 가게 가격 갯수 건물 게시 경우 매화일식
40	갯마을낙지	낙지낙지전골 배달 외식 장소 추천 기준 리하 맛집 산기 성산구 수도 식구 약간 주말 지금 친정 매콤한맛 쭈꾸미볶음 갯마을낙지 수서맛집추천 묵사발 맛스타그램 수다타임 즐시간
41	경남복국	복요리 마산회원구 복국맛 복국집 의창구 창원 포장 부산 중앙동 경남복국 복수백 점심 밥두공기조지기 맞은편 김밥도안주고 암튼회사복귀
42	대풍갈비살	갈비류 소고기 추천 창원 맛집 고기 오늘 가시 가식 갈비살 경고 근처 남양동 대풍 돼지고기 말구 보아 분위기 사돈 사진 삭제 대풍갈비살 대풍육곳간 안창살 안거미 한우 맛스타그램 먹스타그램 창원 상남동 고기 beef
43	만다린	중화요리 추천 중식 창원 가족 개별 방갈로 식사 요리 코스 가성 고급 김해 끼리 독립 레스토랑 마창진 머리 모시 모임 밥집 완전광동어 홍콩여행 단어 회화 error 홍콩아이돌 世一 최고 세계재일 팔로우 좋아요 보내기 \u200d♂️너튜브 광동어과외 중국어과외수강생을
44	목포밴댕이	밴댕이홍어간장게장 게장 렐라 맛집 미리 줌마 창원 추천 인천역 목포밴댕이 밴댕이회 준치회 병어회 간재미회 광어회 건조황석어 인천역밴댕이회거리 맛스타그램
45	삼포복집	복요리 복국 국물 맑은 연경 처음 포복 복수육 맛집 중앙동 삼포복집
46	설향꽃게찜	찜류 맛집 추천 성산구 여기 포장 해물찜 똥손 마님 배달 상남동 생신 엄마 외식 요리 중앙 피하 창원맛집 숨은맛집 남양동 설향꽃게찜 왕갈비해물전복찜 맛집추천 해피엔딩케이크 happyendingcake.☺해피엔딩케이크
47	섬진강식당	생선회 추천 재첩 국내 궁금 바락 박스 생각 아이스 친구 해감 가득 가요 광주 국물 근처 냉동 녹지 다라 미혼 배송 구례 섬진강식당 산채더덕구이정식 6시내고향맛집 구례맛집 함평 철성가든 능이닭백숙 향촌 육회비빔밥 해물탕 배민맛집 🐷🐷
48	신가음정횟집	생선회 횟집 추천 음정 정시 가족 끼리 포장 창원 가음동 가음정시장 신가음정횟집 가오리회 쥐치 매운탕
49	와사비	일식 식당 추천 상남동 감사 같고룸 개인 공간 마산 모시 미리 별도 부탁 상관 손님 신경 이면 자리 장소 접대 종류 돼지맨숀 데릭_판교 데릭_판교역 데릭_삼평동 이베리코 베요타 목살 플루마 가브리살 삼겹살 와사비 청어알젓 미나리 김치찌개 판교아브뉴프랑 판교맛집 판교역맛집 이베리코맛집 맛집 먹스타그램 맛스타그램
50	왕가옥	갈비살 소개 창원 계모임 맛집 수다 식당 양식 여성 이번 점심 중식 한식 상남동 왕가옥 맛스타그램 소고기 한우 소주 맥주
51	원조꽃게탕	꽃게탕 창원 꽃게 맛집 꽃게탕 원조 기억 정도 진짜 여기 정보 추천 골목길 국자 근무 마산 마지막 바로 사람 사시 오늘 원조꽃게탕 중앙동꽃게찜 창원맛집 창원엔 창원맛집 꽃게탕 꽃게찜 창원꽃게찜 중앙동맛집 창원중앙동맛집 꽃게찜추천 창원원조꽃게탕 중앙동오거리맛집 용호동꽃게찜 용호동맛집 추천맛집
52	자갈마당식당	조개및삼겹살구이 가리비 근처 대방동 아시 가요 제곧내 조개류 혹시 선산장 가는날이장날 개더움 볼거리많음 자갈마당식당 칼국수석쇠구이 뜻밖의맛집 배스낚시용조끼득탬 단돈5천원ㅋ.....장인장모님
53	진주명가장어구이	장어구이 가포 맛집 장어 가기 가요 공유 마창진 상관 시간 아시 장어구이 전부 창원 혹시 진주명가장어구이 꼼장어소금구이먹고요
54	천지우식당	
55	토담고디탕	고디탕 곳도 배달 추천 곳저 두산 서동 어디 여기저기 위브 토담고디탕 다슬기탕 고디탕 들깨고디탕 창원직장인점심 창원점심메뉴 창원용호동점심 창원상남동맛집 창원상남동점심 창원맛집 상남동맛집추천 고디탕맛집 다슬기탕맛집
56	물꽁식당	두루치기정식수육정식 맛집 아시 주맣 창원 추천 혹시 부산 중구 보수동 물꽁식당 물꽁아구찜 아구찜
57	하늘정원	돼지갈비 양갈비 추천 창원 가족 중식 고기 교실 라면 배틀 산모 식사 아시 안민 임신 지역 카페 키즈 하늘정원 한마디 회식 가게 2주만에집으로 신세계백화점 아쿠아리움 하늘정원 알차게놀았다
58	우람한우마을(상남동)	
59	경복궁창원점	숯불갈비 상견례 돌잔치 창원 경복궁 준비 저희 일단 코스 음식 하나 장소 드레스 미리 부모님 사진 선물 선택 한복 메컵 아가 경복궁창원점 돌잔치 가족모임
60	함흥집	소고기(등심) 추천 맛집 냉면 마산 소고기 거리 바로가기 양식 공지 혹시 게시판 고급 드림 메뉴 아래 오픈 일식 정보 창원 코로나 중복⠀낮잠 지난피드 어제 병목안계곡 함흥집 물놀이 아들힘빼기 아빠도힘내 아빠랑아들 계곡물놀이 24개월아기
61	금와	일식 스시 추천 남자 노렌 마산 식사 일식집 한정식 가보 곳도 군데 기념 돈까스 보고 부탁 블로그 생일 서여 순이 신분 금와 금와달팽이 아프리카왕달팽이 아프리카대왕달팽이
62	노렌스시	초밥 추천 마산 스시 상견례 노렌 음식 맛집 일식집 창원 코스 식사 분위기 식당 초밥 부모님 양식 장소 저희 조금 가족 오랜만에 노렌스시.맛있다 마산 창원 먹스타그램 맛스타그램 스시 초밥 인스타푸드 foodpic daily instafood food lunch 점심 일상 공유 맞팔
63	대가	삼계탕 삼계탕 갑자기 계심 동네 미리 신랑 자주 추천 혹시 대가 목동맛집 목동고기집 목동역맛집 먹팔 먹스타맞팔 신정동맛집 고기스타그램 맛집추천 한우맛집
64	도원오리궁	오리 점심 오늘 거리 그릇 근처 금향 기분 복도 복용 설연휴 신랑 안드네 압탕이랍 오리궁 요거 이담 인삼 일찍 장보기 한약재 맛스타그램 마산맛집 마산오리맛집 도원오리궁 한방오리수육 오리불고기 오리탕 여사장님 짱친절 센스만점 룸 오리수육 건강한맛
65	청송	소고기 맛집 동쪽 마산 메뉴 밥집 산호 산호동 식당 양덕 여자 추천 사전투표 경북도지사후보 임미애 문경 영주 봉화 울진 상주 예천 안동 영양 영덕 청송 의성 구미 김천 군위 포항 영천 칠곡 성주 고령 경산 경주 청도 울릉도 독도
66	백두봉삼계탕	삼계탕 삼계탕 창원 닭도리탕 두봉 방문 새벽 친정 거의 대서 동생 마산 마산합포구 마지막 서울 수다 시간 어제 예약 오늘 오라 백두봉삼계탕 삼계탕맛집 다대포맛집 부산맛집 일상
67	백제령삼계탕	삼계탕 삼계탕 마산 맛집 모시 생각 저녁 추천 국물 마스크 민물장어 부모님 아침 저희 정말 토요일 한잔 고기 근처 나들이 달천 백제령삼계탕 Since1982 삼계탕&전복 맛집추천 오늘의기온26도
68	봉래식당	장어구이 민물장어 누비 당첨 됫으 보신 부탁 신랑 추천 대너리스 빵맛나다 봉래식당 보리밥최고 담엔꼭 북한강막국수닭갈비 먹으러가야지
69	북경성	중화요리 탕수육 공기 마산 짜장 추천 기본 류산슬 북경 어디 오늘 요리 저녁 중국집 코스 대서 된거 따님 만두 만원 무조건 먹남 먹는게남는다 leahpark05 지브로와 베라바이오 베라365 씨케이엔터 광진구 자양동 건대 건대입구 건대입구역 건대입구역술집 북경성 북경성양꼬치 마라탕 꿔바로우 가지튀김 깐풍기 마라볶음면 마라볶음 중국요리집 연태고량주 연태고량 중국술 중국술집 한잔하기좋은날 한잔하고 한잔먹고 한잔합시다
70	석정원숯불갈비	돼지갈비 추천 갈비 거리 돼지갈비 맛집 숯불 식당 인원 정원 회식 소수 정도 주변 창포 처음 추가 하동 석정원숯불갈비
71	소반	한우 거나 메뉴 모시 부근 부모님 자산동 추천 컬렉터양정원 소반 소반전시 좋은것하나씩 에디터갑의클립
72	신마산합천흑돼지황토한우	
73	아자방	삼계탕 마산 맛집 삼계탕 모시 방문 부모님 어른 운영 엄마가찍어준우리 큐브라테 청도까페 아자방
74	영생각	중화요리 탕수육 마산 정말 진짜 자장면 추천 중국집 가게 거리 기본 어디 어디가 공유 금향 대해 동네 된거 맛집 변형 별로 영생각
75	유가네뽕잎칼국수	칼국수만두 칼국수 양식 공지 바로가기 게시판 렐라 맛집 뽕잎 줌마 가격 당일 모든 아래 오픈 유가 진동 창원 코로나 가득 게시 유가네뽕잎칼국수 낙지볶음칼국수 볶음칼국수 해물칼국수 콩비지 창원맛집 마산맛집 진동맛집 고성맛집 맛점 맛저 먹스타그램 먹방기록 데일리 일상 유지어터 다이어터 먹는거에진심인편 태봉맛집
76	유림산천식당	장어구이 산천 유림 가보 가요 근처 민물장어 보신 부모님 신분 진동 후기 유림산천식당고창산
77	인혜돌곱창	곱창전골 도움말 마산 복사 영상 곱창전골 광고 소요 이상 자동 재생 창동 코드 트랙 화질 가기 계속 고향 곱창 공유소스 과식 인혜돌곱창 왕코등갈비 명동복집
78	판문점(오동동)	
79	한옥산에산에	흑돼지 국밥홍어삼합명태전 안주 옥산 정말 막걸리 메이커 분위기 우먼 진짜 추천 가면 가야 각오 강강강 거리 결과 경상남도 경치 기어 길찾기 느낌 한옥산에산에
80	한우촌(마산)	
81	홍화	곰탕 국밥 맛집 소고기 홍화 바디로그홍화 바디프로필 셀프바디프로필 운동 협찬
82	복자할매충무김밥	충무김밥 충무김밥 마산 맛집 추천 근처 부탁 애용 양덕동 점심때 창원 충무 통영 복자할매충무김밥별 창원 마산 창원맛집 마산맛집 창원먹방 마산먹방 상남동 합성동 댓거리 중앙동 충무김밥 김밥 김밥맛집 오징어 깍두기 시락국 ChangWon_food_ 밥도둑
83	24시 남양돼지국밥	
84	감자꽃피는감자탕	감자탕 포장 해장국 가능 근처 마산 마산역 보고 볼일 지금 추천 해갈 현동 감자꽃피는감자탕 놀이터식당 등뼈찜 양념매콤 밥을부르는맛 사리추가필수
85	강변횟집	생선회 초장 포장 마산 마산역 추천 횟집 근처 맛집 물회 어회 흙내 갑자기 곳도 껍니 내일 데리 라서 마산어시장 마산합포구 민물 어린이날 선물 강변횟집 방아실맛집물가
86	거창가든	오리 창원 마산 맛집 진해 불고기 생각 횟집 곱창 돈까스 리스트 상남 짬뽕 추천 갈비 국밥 모두 아구찜 어디 오리 추가 거창가든 2021.03.18 창원가볼만한곳 창원마산맛집 창원맛집 좋아요 좋아요반사 음식그램
87	남촌칼국수	칼국수 칼국수 맛집 마산 추천 콩국수 감사 날씨 맛나 먹기 미리 바지락 수집 신랑 어디 오늘 인근 정보 중리 춘하 친정엄마 남촌칼국수 논스페이스2000 휴일나들이
88	독불장군	갈비 아기 중리 추천 갈비 개월 고기 룸있는 소고기 환기 인생네컷 독불장군 만나면또라이
89	마당있는집(합성동)	
90	돈사골매실국밥	돼지국밥 국밥집 매실 사골 사시 영업 이제 정류장 회산교 회원동 감동 정 마음 국밥 손님 교감 마산 북마산 매실국밥 돈사골매실국밥 바른매실국밥 국밥명작 매당 내서맛집 중리맛집 돼지국밥맛집 행복합니다 감사합니다
91	소나무식당	생선회 배달 어시장 근처 석전동 추천 횟집 마산 매운탕 여태 처음 회랑 가족이랑또오고파 생선구이존맛 이른점심 어쩌다보니 거리두기 에너쥐스타걸 출근전 맛집투어 맛집추천 소나무식당 해물밥상 생선구이 칼국수 해물전골 먹스타 맛스타 직장인 일상기록 해산물맛집 생선구이맛집 마시안해변맛집 용유도맛집 영종도맛집 인천맛집
92	맛있는 생오리	
93	옥필가	수육탕류 근처 선지국 철분 옥필가 창원맛집 소고기국밥맛집 소고기수육맛집 foodie foodporn eater 먹스타그램 맛스타그램 changwon korea 알라네창원 알라네마산 알라네마산합포구 알라네소고기국밥 알라네수육
94	왕창이해물칼국수	해물칼국수 칼국수 합성동 추천 해물 돈까스 맛집 왕창 근처 데이트 옛날 창원 오늘 마산 소스 수제비 양도 어디가 일이 커피 가기 쟈니s로그 합성동해장맛집 왕창이해물칼국수
95	우람한우마을(마산)	
96	원조할매낙지	낙지볶음 맛집 창원 곱창전골 낙지 볶음 감자탕 건물 경남 김치 남고 내일 대국 대학원 도청 돼지고기 마산 부경 산동 새벽 생선 범일동원조할매낙지 원조할매낙지 낙곱새 부산낙곱새
97	장원	숯불갈비 불고기 돼지갈비 마산 가게 갈비 계속 국물 늑힘 당면 래미 마창진 맛집 무한리필 보신 양덕 장원 퀄리티 평가 SHETHREE SHETHREEMAGAZINE アイズワン izone好きな人と繋がりたい wizoneと繋がりたい wizone あいずわん 好きと言わせたい jangwonyoung leechaeyeon joyuri choiyena anyujin 矢吹奈子 kwoneunbi kanghyewon 本田仁美 kimchaewon kimminju izone 권은비 宮脇咲良 강혜원 최예나 이채연 김채원 김민주 조유리 안유진 장원
98	키다리횟집	생선회 어회 횟집 근처 마산 마산역 배달 어시장 물회 석전동 처음 초장 추천 키다리 포장 기분 냄새 다음 단골 매운탕 민물 자갈치시장 키다리횟집 부산맛집 부산
